{
  "id": "CAP-007",
  "name": "Persistence and replay",
  "review_state": "draft",
  "purpose": [],
  "actors_consumers": [],
  "vocabulary": [],
  "invariants": [],
  "interface": [],
  "authoritative_model": [],
  "flows": [],
  "failure_refusal": [],
  "verification": [],
  "artifact_dispositions": [],
  "inherited_decision_coverage": [],
  "unresolved_questions": ["Persistence and replay packet has not been grilled"]
}
