{
  "id": "CAP-009",
  "name": "Presentation and interface",
  "review_state": "draft",
  "purpose": [],
  "actors_consumers": [],
  "vocabulary": [],
  "invariants": [],
  "interface": [],
  "authoritative_model": [],
  "flows": [],
  "failure_refusal": [],
  "verification": [],
  "artifact_dispositions": [],
  "inherited_decision_coverage": [],
  "unresolved_questions": ["Presentation and interface packet has not been grilled"]
}
